{
  "schema_version": 1,
  "updated": "2026-10-31",
  "policy": "Her sayının bir durumu vardır. 'reported' (raporlanan) = projenin kendi yazılarından alınmış, burada yeniden çalıştırılmamış (özel veri gerektirir). 'measured' (ölçülen) = bu depodaki bir komutla üretilmiş. 'not_measured' / 'unvalidated' = bilinen boşluklar; bilerek listelenir.",

  "evaluations": {
    "cv5_stage2": {
      "title": "Aşama 2 için 5 katlı çapraz doğrulama (katman dışı tahmin)",
      "protocol": "Görüntüler benzerliğe göre (eşik 0.85) gruplanır; böylece birbirine çok benzeyen kareler farklı katlara dağılmaz. Her kat kalan dördüyle eğitilir ve modelin hiç görmediği görüntüler üzerinde ölçülür; en iyi epoch seçimi ölçülen parçayla değil, katın kendi doğrulama parçasıyla yapılır. Aşama 2 kırpımları etiketin etrafından, x ve y yönünde en fazla 35 piksellik düzgün dağılımlı rastgele kaydırmayla alınır (Aşama 1'in lokalizasyon hatasının benzetimi).",
      "model": "7 landmark'lı Aşama 2 (MobileNetV3-small + ısı haritası + soft-argmax), PyTorch",
      "n_images": 337,
      "n_landmarks": 1582,
      "status": "reported",
      "source": "docs/tr/TEKNIK_DOKUMAN.md bölüm 5.5, 6.1, 6.2; scripts/40_rafinaj7_egit.py (JITTER = 35)",
      "reproduce": ["python scripts/45_rafinaj7_cv.py --kat 5", "python scripts/46_cv_omurga_analiz.py"],
      "requires_private_data": true
    },
    "holdout50": {
      "title": "Tek seferlik ayrılmış test kümesi",
      "protocol": "Temizlenmiş 337 görüntü, benzerlik gruplarına göre 236 / 51 / 50 (eğitim / doğrulama / test) olarak bölünür. Test kümesi raporlama için yalnızca bir kez kullanılır.",
      "model": "İki aşamalı boru hattı, PyTorch (2 landmark'lı önceki nesil; kaynak, karar tablosunun hangi model nesliyle üretildiğini ayrıca belirtmiyor)",
      "n_images": 50,
      "status": "reported",
      "source": "docs/tr/MOBIL_YAPILACAKLAR.md bölüm 2 ve Faz 1",
      "reproduce": ["python scripts/20_tam_degerlendirme.py", "python scripts/26_tflite_degerlendirme.py"],
      "requires_private_data": true
    }
  },

  "landmark_error": {
    "evaluation": "cv5_stage2",
    "status": "reported",
    "source": "docs/tr/TEKNIK_DOKUMAN.md bölüm 6.1",
    "rows": [
      {"type": "axillary", "n": 674, "median_px": 3.045, "p90_px": 7.518, "label_floor_px": 2.45},
      {"type": "c7", "n": 182, "median_px": 11.772, "p90_px": 31.553, "label_floor_px": null},
      {"type": "sacrum", "n": 180, "median_px": 11.345, "p90_px": 25.354, "label_floor_px": null},
      {"type": "spine", "n": 546, "median_px": 20.489, "p90_px": 41.958, "label_floor_px": 5.58}
    ],
    "notes": [
      "Hatalar, 640 × 640'a gerilmiş eğitim görüntülerinin pikseli cinsindendir.",
      "Aksiller noktalar için etiket gürültü tabanı, aynı fotoğrafın bağımsız etiketleri arasındaki ölçülmüş farktır; omurga noktaları için (5.58) yeniden etiketlemeden, bırak-birini-dışarıda yöntemiyle tahmin edilen bir üst sınırdır.",
      "Katlar arasındaki doğal yayılım 2.1 pikseldir: iki yapılandırma arasındaki bundan küçük farklar istatistiksel olarak anlamlı değildir."
    ]
  },

  "angle_error": {
    "evaluation": "cv5_stage2",
    "status": "reported",
    "source": "docs/tr/TEKNIK_DOKUMAN.md bölüm 6.2",
    "rows": [
      {"measurement": "axillary_tilt", "median_deg": 0.271, "p90_deg": 1.237, "signal_median_deg": 2.21, "label_floor_deg": 0.435},
      {"measurement": "coronal_balance", "median_deg": 1.292, "p90_deg": 3.385, "signal_median_deg": 1.71, "label_floor_deg": null}
    ],
    "label_floor_averaged_deg": 0.232,
    "notes": [
      "Sinyal, ölçülen büyüklüğün veri kümesindeki mutlak değerinin medyanıdır, yani ölçmeye çalıştığımız şeyin büyüklüğü. Hata / sinyal, iki sütundan türetilir.",
      "Tek etiketli gürültü tabanı 0.435 derecedir; bağımsız etiketlerin ortalaması alınınca 0.232'ye iner (337 görüntünün 233'ü ortalanmış etiket taşır).",
      "Bunlar, benzetimle verilmiş kaba noktalarla Aşama 2 hatalarıdır; gerçek Aşama 1 çıktılarıyla uçtan uca bir ölçüm DEĞİLDİR ve cihaz üstü ölçüm DEĞİLDİR."
    ]
  },

  "screening_decision": {
    "evaluation": "holdout50",
    "status": "reported",
    "source": "docs/tr/MOBIL_YAPILACAKLAR.md bölüm 2 (test, n = 50)",
    "n": 50,
    "rows": [
      {"threshold_deg": 3, "positives": 16, "true_positives": 15, "correct": 44, "accuracy": 0.880, "macro_f1": 0.870, "recall": 0.938},
      {"threshold_deg": 5, "positives": 6, "true_positives": 5, "correct": 46, "accuracy": 0.920, "macro_f1": 0.834, "recall": 0.833},
      {"threshold_deg": 7, "positives": 4, "true_positives": 4, "correct": 50, "accuracy": 1.000, "macro_f1": 1.000, "recall": 1.000}
    ],
    "notes": [
      "Kaynak düzeltmesi: önceki README bu tabloyu 5 katlı çapraz doğrulamaya atfediyordu. Aynı sayılar MOBIL_YAPILACAKLAR.md içinde n = 50'lik test kümesi altında geçiyor ve '16 pozitif vakanın 15'i' 337 görüntülük bir değerlendirmeden çıkamaz; bu yüzden burada ayrılmış n = 50 sonucu olarak sınıflandırıldı. Doğrulamak için scripts/20 yeniden çalıştırılmalı.",
      "Wilson %95 aralıkları, sayımlardan gösterim anında hesaplanır. 4 ile 16 pozitif vakayla aralıklar geniştir: 7 derece satırı (4/4) hiçbir iddiayı desteklemez.",
      "Eşikler aksiller eğime uygulanır; bu bir yüzey asimetrisi göstergesidir, Cobb açısı değildir."
    ]
  },

  "two_stage_ablation": {
    "evaluation": "holdout50",
    "status": "reported",
    "source": "docs/tr/MOBIL_YAPILACAKLAR.md bölüm 2",
    "rows": [
      {"id": "keypoint_error_median", "metric": "Keypoint hatası, medyan", "unit": "px", "stage1": 24.35, "stage1_plus_2": 3.55, "floor": 2.45},
      {"id": "keypoint_error_mean", "metric": "Keypoint hatası, ortalama", "unit": "px", "stage1": 27.37, "stage1_plus_2": 7.83, "floor": null},
      {"id": "angle_error_median", "metric": "Açı hatası, medyan", "unit": "deg", "stage1": 2.094, "stage1_plus_2": 0.380, "floor": 0.23},
      {"id": "angle_error_p90", "metric": "Açı hatası, p90", "unit": "deg", "stage1": 4.742, "stage1_plus_2": 1.706, "floor": null},
      {"id": "pck_5px", "metric": "PCK@5px", "unit": "%", "stage1": 5, "stage1_plus_2": 72, "floor": null},
      {"id": "pck_10px", "metric": "PCK@10px", "unit": "%", "stage1": 18, "stage1_plus_2": 90, "floor": null}
    ],
    "notes": [
      "Aşama 1 tek başına eğitim, doğrulama ve test kümelerinde aynı ~24 px hatayı verdi; yani kendi eğitim verisini bile öğrenemedi: darboğaz veri miktarı değil, temsil biçimidir.",
      "Noktaların %10'u hâlâ 10 pikselden fazla sapıyor; kuyruk çoğunlukla eğilmiş ya da atipik pozlardan geliyor."
    ]
  },

  "export_variants": {
    "evaluation": "holdout50",
    "status": "reported",
    "source": "docs/tr/MOBIL_YAPILACAKLAR.md Faz 1",
    "rows": [
      {"variant": "float16", "selected": true, "size_mb": 6.40, "median_px": 3.44, "median_deg": 0.417, "shoulder_accuracy": 0.860, "note": null},
      {"variant": "dynamic_range_quant", "selected": false, "size_mb": 3.59, "median_px": 3.80, "median_deg": 0.463, "shoulder_accuracy": 0.820, "note": "Açı ölçütünü geçiyor ama hangi omzun yüksek olduğu kararını bozuyor."},
      {"variant": "float32", "selected": false, "size_mb": 12.57, "median_px": 3.45, "median_deg": 0.412, "shoulder_accuracy": 0.860, "note": null},
      {"variant": "full_integer_int8", "selected": false, "size_mb": 3.58, "median_px": null, "median_deg": null, "shoulder_accuracy": null, "note": "50 görüntünün hiçbirinde tespit yok: ortak tek çıktı ölçeği (3.59) 0–1 aralığındaki güveni ~0.3 kuantizasyon adımına sıkıştırıyor, hiçbir aday 0.25 eşiğini geçemiyor."},
      {"variant": "int8_int16_activations", "selected": false, "size_mb": 3.79, "median_px": 35.10, "median_deg": 1.644, "shoulder_accuracy": 0.420, "note": null},
      {"variant": "pytorch_reference", "selected": false, "size_mb": null, "median_px": 3.55, "median_deg": 0.380, "shoulder_accuracy": 0.860, "note": "float16'nın PyTorch'a göre maliyeti yaklaşık 0.04 derece."}
    ],
    "notes": [
      "2 landmark'lı önceki modellerde ölçüldü. v0.1.0 ile gelen 7 landmark'lı modeller scripts/52 ile dönüştürüldü ama kuantizasyon maliyetleri değerlendirilmedi (bkz. boşluklar)."
    ]
  },

  "model_complexity": {
    "status": "measured",
    "source": "python -m skolyoz_metrics bench arch (sayılar ağırlıklardan bağımsızdır); tests/test_bench_arch.py ile çapraz denetlenir",
    "rows": [
      {"model": "stage1_yolo11n_pose_7kpt", "params": 2688252, "gflops": 6.717, "input": "1x3x640x640", "note": "2 landmark'lı varyantın 2.661.957 parametresi vardır; önceki dokümanlar bu değeri 7 landmark'lı model için yazmıştı."},
      {"model": "stage2_rafinaj7", "params": 405340, "gflops": 0.2265, "input": "1x3x128x128", "note": "Landmark başına bir kez çağrılır (ölçüm başına 7 kez)."}
    ]
  },

  "artifacts": {
    "status": "measured",
    "source": "Orijinal deponun v0.1.0 ('v7' derlemesi) çıktıları; zipfile + sha256 ile incelendi. İkili dosyalar bu depoda yoktur.",
    "rows": [
      {"file": "assets/asama1.tflite", "bytes": 5575676, "sha256": "9737b9d5792b7e6fc8f6a29680ebcf59fac52bca4a01672564b97e5d7648b3d2", "note": "Aşama 1, float16, sıkıştırılmadan saklanır (mmap)."},
      {"file": "assets/asama2.tflite", "bytes": 860284, "sha256": "8f59347e45fe4354a986fb05d70acd4fa4f4d9ff69c376f6e3bad3a0d9bdb5b2", "note": "Aşama 2, float16, sıkıştırılmadan saklanır (mmap)."},
      {"file": "skolyoz_olcum_v7_release_unsigned.apk", "bytes": 20185230, "sha256": "ec25e58e2c64a657fa277f18225ab62983c7af10dc82e62b9f246ee9d9af23e7", "note": "Yalnızca arm64-v8a + armeabi-v7a."},
      {"file": "skolyoz_olcum_v7_debug.apk", "bytes": 33582755, "sha256": "d11fde9e4498e70ad69d10f5bcfcf050736b388383401fd90ceb494abdbfa9cf", "note": "Evrensel (x86 / x86_64 dahil)."}
    ]
  },

  "parity": {
    "status": "reported",
    "source": "docs/tr/MOBIL_YAPILACAKLAR.md Faz 3; android/app/src/test; tests/test_golden_parity.py",
    "jvm_unit_tests": 42,
    "instrumented_tests": 4,